Authors,In Graph Label,Code,Title,Year,Source title,Volume,Issue,Page start,Page end,Page count,Cited by,Link,Abstract,Inclusion?,Author Keywords,Column1
Iyer G.| Soberman D.A.,Iyer & Soberman (2016),IS_16,Social responsibility and product innovation,2016,Marketing Science,35,5,727,742,15,44,https://www.scopus.com/inward/record.uri?eid=2-s2.0-84988683726&doi=10.1287%2fmksc.2015.0975&partnerID=40&md5=da47fdbb8106fc88fe0b242fdb256e23,This paper examines the incentives of firms to invest in socially responsible product innovations. Our analysis connects the existence of socially responsible innovations to the presence of intrinsic and extrinsic social responsibility preferences. In addition to deriving economic value from the product| consumers have heterogeneous intrinsic needs to consume products that are socially responsible. They also have extrinsic social comparison preferences that are based on their meetings with others in social interactions. The frequency of these meetings are endogenous to the consumption choices of consumers. A consumer enjoys a social comparison benefit if her consumption decision is more socially responsible than the consumer that she meets in a social interaction and a social comparison cost if it is less socially responsible. The analysis reveals a nonmonotonic effect of social comparison effects on innovation incentives. When the economic value of a product is relatively small| the incentive to innovate decreases as social comparison effects increase. By contrast| when the economic value of a product is sufficiently large| increases in social comparison effects increase the incentive to innovate. Social comparison benefits and costs have different effects on competition between firms. In particular| social comparison benefits soften price competition| whereas social comparison costs tend to exacerbate price competition. We also identify market conditions where a monopoly invests more or less compared to a firm facing competition. © 2016 INFORMS.,1,Altruism; Competitive strategy; Innovation; R&D strategy; Social comparison; Social responsibility; Sustainability,
Karmarkar U.R.| Bollinger B.,Karmakar & Bollinger (2015),KB_15,BYOB: How bringing your own shopping bags leads to treating yourself and the environment,2015,Journal of Marketing,79,4,1,15,14,66,https://www.scopus.com/inward/record.uri?eid=2-s2.0-84937554414&doi=10.1509%2fjm.13.0228&partnerID=40&md5=66877ee277b6c773c1faf4d399d2533d,As concerns about pollution and climate change become more mainstream| the belief that shopping with reusable grocery bags is an important environmental and socially conscious choice has gained prevalence. In parallel| firms have joined policy makers in using a variety of initiatives to reduce the use of disposable plastic bags. However| little is known about how these initiatives might alter other elements of consumers' in-store behavior. Using scanner panel data from a single California location of a major grocery chain| and controlling for consumer heterogeneity| the authors demonstrate that bringing one's own bags increases purchases of not only environmentally friendly organic foods but also indulgent foods. They use experimental methods to further explore the expression of these effects and to consider the effects of potential moderators| including competing goals and store policies. The findings have implications for decisions related to product pricing| placement and assortment| store layout| and the choice of strategies employed to increase the use of reusable bags. © 2015| American Marketing Association.,1,Green marketing; Licensing; Mixed methods; Priming; Sustainability,
Kidwell B.| Farmer A.| Hardesty D.M.,Kidwell| Farmer & Hardesty (2013),KFH_13,Getting liberals and conservatives to go green: Political ideology and congruent appeals,2013,Journal of Consumer Research,40,2,350,367,17,210,https://www.scopus.com/inward/record.uri?eid=2-s2.0-84880111859&doi=10.1086%2f670610&partnerID=40&md5=79362050845a68c3a03aa16a8e4d6414,The authors develop a conceptual model of how the congruence of political ideology and persuasive appeals enhances sustainable behaviors. In study 1| persuasive appeals consistent with individualizing and binding moral foundations were developed to enhance liberal and conservative recycling. In study 2| individualizing and binding appeals were tested on actual recycling behavior using a longitudinal field study to demonstrate the effectiveness of messages congruent with the moral foundations of liberals and conservatives. Study 3 demonstrated that enhanced fluency represents the underlying psychological process that mediates the relationship between message congruence and intentions. Moreover| study 3 established that spillover effects resulting from increased intentions to engage in sustainable disposition behavior enhance intentions to engage in sustainable acquisition and consumption behaviors. Finally| study 4 ruled out potential message confounds to demonstrate the robustness of the findings. Practical implications for marketers and public policy officials interested in increasing sustainable behaviors are offered. © 2013 by JOURNAL OF CONSUMER RESEARCH| Inc.,1,,
Katsikeas C.S.| Leonidou C.N.| Zeriti A.,Katsikeas| Leonidou & Zeriti (2016),KLZ_16,Eco-friendly product development strategy: antecedents| outcomes| and contingent effects,2016,Journal of the Academy of Marketing Science,44,6,660,684,24,79,https://www.scopus.com/inward/record.uri?eid=2-s2.0-84953449466&doi=10.1007%2fs11747-015-0470-5&partnerID=40&md5=ff2d78a0118b92d89d4498b58b2cb7df,Integrating sustainability aspects into product development has long been recognized as a strategic priority for practitioners. Yet the literature reports mixed results on the product development effectiveness outcomes of sustainable product development strategies| while scant research has investigated how companies integrate environmental aspects into product development. This study develops a model that integrates effectiveness-enhancing outcomes and organizational inputs of eco-friendly product development strategies. Using questionnaire responses from firms from multiple industries| supplemented with lagged primary product development performance data| we find that top management commitment and corporate environmental support policies can facilitate eco-friendly product development strategies| while environmental performance incentives do not. In turn| the adoption of such strategies has a positive effect on firms’ product development effectiveness. This effect weakens when business conditions are highly complex but tends to become stronger with increasing levels of munificence in the business environment. These findings have important implications for practitioners and researchers that are discussed. © 2016| The Author(s).,1,Business environment; Green; Innovation; Performance; Product development; Sustainability; Top management commitment,
Leonidou C.N.| Katsikeas C.S.| Morgan N.A.,Leonidou| Katsikeas & Morgan (2013),LKM_13,"""Greening"" the marketing mix: Do firms do it and does it pay off?",2013,Journal of the Academy of Marketing Science,41,2,151,170,19,229,https://www.scopus.com/inward/record.uri?eid=2-s2.0-84874148541&doi=10.1007%2fs11747-012-0317-2&partnerID=40&md5=e97b0b4e9c897f9f17ffffb77d7e337b,"Growing concern about the sustainability of the natural environment is rapidly transforming the competitive landscape and forcing companies to explore the costs and benefits of ""greening"" their marketing mix. We develop and test a theoretical model that predicts (1) the role of green marketing programs in influencing firm performance| (2) the impact of slack resources and top management risk aversion on the deployment of such programs| and (3) the conditioning effects that underpin these relationships. Our analyses show that green marketing programs are being implemented by firms| and we find evidence of significant performance payoffs. Specifically the results indicate that green product and distribution programs positively affect firms' product-market performance| while green pricing and promotion practices are directly positively related to firms' return on assets. In addition| industry-level environmental reputation moderates the links between green marketing program components and firms' product-market and financial performance. Finally| we find that slack resources and top management risk aversion are independently conducive to the adoption of green marketing programs-but operate as substitutes for each other. © 2012 Academy of Marketing Science.",1,Competitive intensity; Firm performance; Green marketing; Industry reputation; Risk aversion; Slack resources; Stakeholder theory,
Luchs M.G.| Naylor R.W.| Irwin J.R.| Raghunathan R.,Luchs| Naylor| Irwin & Ragunahtan (2010),LNIR_10,The sustainability liability: Potential negative effects of ethicality on product preference,2010,Journal of Marketing,74,5,18,31,13,569,https://www.scopus.com/inward/record.uri?eid=2-s2.0-77956708677&doi=10.1509%2fjmkg.74.5.18&partnerID=40&md5=d16d359c33d96c4546e6514d72f6b37d,"Manufacturers are increasingly producing and promoting sustainable products (i.e.| products that have a positive social and/or environmental impact). However| relatively little is known about how product sustainability affects consumers' preferences. The authors propose that sustainability may not always be an asset| even if most consumers care about social and environmental issues. The degree to which sustainability enhances preference depends on the type of benefit consumers most value for the product category in question. In this research| the authors demonstrate that consumers associate higher product ethicality with gentleness-related attributes and lower product ethicality with strength-related attributes. As a consequence of these associations| the positive effect of product sustainability on consumer preferences is reduced when strength-related attributes are valued| sometimes even resulting in preferences for less sustainable product alternatives (i.e.| the ""sustainability liability""). Conversely| when gentleness-related attributes are valued| sustainability enhances preference. In addition| the authors show that the potential negative impact of sustainability on product preferences can be attenuated using explicit cues about product strength. © 2010| American Marketing Association.",1,Corporate social responsibility; Ethical products; Green marketing; Implicit associations; Sustainability,
Mookerjee S.| Cornil Y.| Hoegg J.,Mookerjee| Cornil & Hoegg (2021),MCH_21,From Waste to Taste: How “Ugly” Labels Can Increase Purchase of Unattractive Produce,2021,Journal of Marketing,85,3,62,77,15,15,https://www.scopus.com/inward/record.uri?eid=2-s2.0-85104425291&doi=10.1177%2f0022242920988656&partnerID=40&md5=82ae8bfc4fc18b8b3cef238e697c88aa,Food producers and retailers throw away large amounts of perfectly edible produce that fails to meet appearance standards| contributing to the environmental issue of food waste. The authors examine why consumers discard aesthetically unattractive produce| and they test a low-cost| easy-to-implement solution: emphasizing the produce’s aesthetic flaw through “ugly” labeling (e.g.| labeling cucumbers with cosmetic defects “Ugly Cucumbers” on store displays or advertising). Seven experiments| including two conducted in the field| demonstrate that “ugly” labeling corrects for consumers’ biased expectations regarding key attributes of unattractive produce—particularly tastiness—and thus increases purchase likelihood. “Ugly” labeling is most effective when associated with moderate (rather than steep) price discounts. Against managers’ intuition| it is also more effective than alternative labeling that does not exclusively point out the aesthetic flaw| such as “imperfect” labeling. This research provides clear managerial recommendations on the labeling and the pricing of unattractive produce while addressing the issue of food waste. © The Author(s) 2021.,1,aesthetics; debiasing; food waste; labeling; sustainability; ugliness penalty,
Nickerson D.| Lowe M.| Pattabhiramaiah A.| Sorescu A.,Nickerson| Lowe| Pattabhiramaiah & Sorescu (2022),NLPS_22,The Impact of Corporate Social Responsibility on Brand Sales: An Accountability Perspective,2022,Journal of Marketing,86,2,5,28,23,6,https://www.scopus.com/inward/record.uri?eid=2-s2.0-85118953170&doi=10.1177%2f00222429211044155&partnerID=40&md5=40babe03ba29e4ea6abc0312082a326e,Consumers are increasingly mindful of corporate social responsibility (CSR) when making purchase and consumption decisions| but evidence of the impact of CSR initiatives on actual purchase decisions is lacking. This article introduces a novel brand accountability–based framework of consumer response to CSR initiatives| which categorizes CSR efforts as “corrective|” “compensating|” or “cultivating goodwill.” Leveraging a database of CSR press releases by leading consumer packaged goods brands| the authors examine the effect of the different types of CSR announcements on brand sales. The findings suggest that CSR initiatives that genuinely aim to reduce a brand's negative externalities (“corrective” and “compensating”) lift sales| whereas CSR actions focused on philanthropy (“cultivating goodwill”) can hurt sales. The authors propose two moderators—CSR reputation and CSR focus on environmental or social causes—and a mechanism for these effects| which they examine under controlled experimental settings. The experimental results show that| conditional on CSR reputation| consumers perceive varying degrees of sincerity in the different CSR types and that sincerity mediates the effect of CSR type on purchase intentions. Overall| the results suggest that consumers are more inclined to reward firms that directly reduce the negative by-products of their own business practices than to be impressed by public goodwill gestures. © American Marketing Association 2021.,1,brand sincerity; corporate social responsibility; CSR reputation; environmental initiatives; social initiatives; sustainability,
Olson E.L.,Olson (2013),O_13,It's not easy being green: The effects of attribute tradeoffs on green product preference and choice,2013,Journal of the Academy of Marketing Science,41,2,171,184,13,185,https://www.scopus.com/inward/record.uri?eid=2-s2.0-84874190075&doi=10.1007%2fs11747-012-0305-6&partnerID=40&md5=6878b035a17154cc19343935e0244558,"Despite widespread pro-green attitudes| consumers frequently purchase non-green alternatives. One possible explanation for this value-action gap is the tradeoffs that green products often force on their users: higher prices| lower quality| and/or reduced performance. The current study uses conjoint analysis to uncover the attribute preferences of car and TV buyers when green attributes are negatively correlated with conventional attributes. These attribute preferences are then used to predict choice among sets of green and less green alternatives currently sold in the marketplace. Strong preferences for green products are found when tradeoffs are not apparent| but preference shifts significantly to less green compromise alternatives when the actual attribute tradeoffs are considered. Although general preference is reduced by tradeoffs| a green product offering some compensatory advantage on a conventional attribute does attract a broader spectrum of consumers| while only ""dark green"" consumers are willing to pay the price to go green when the product offers few compensatory qualities. In all cases| however| predicted buyers of the greenest technologies offset some of their environmental benefits by choosing more energy-thirsty specifications on negatively correlated conventional attributes. Managerial and public policy implications of the findings are then discussed. © 2012 Academy of Marketing Science.",1,Green product adoption; Negative attribute correlations; Rebound effects; Sustainability; Value-action gap,
Olsen M.C.| Slotegraaf R.J.| Chandukala S.R.,Olsen| Slotegraaf & Chandukala (2014),OSC_14,Green claims and message frames: How green new products change brand attitude,2014,Journal of Marketing,78,5,119,137,18,229,https://www.scopus.com/inward/record.uri?eid=2-s2.0-84921371169&doi=10.1509%2fjm.13.0387&partnerID=40&md5=c7c640103a15b030c907c331f3033f4c,"In response to a top ten global consumer trend| firms are increasingly introducing environmentally sustainable (""green"") new products. Firms allocate significant resources to this area; thus| the authors consider the brand-level implications by investigating how the introduction of green new products changes attitude toward the brand. In examining this relationship| they draw from social identity and framing theories to investigate drivers of green new product introductions as well as the moderating effects of message framing| source credibility| and product type. Estimating a three-stage least squares model based on new product introductions from 75 brands across a four-year time period (2009-2012)| the authors find that green new product introductions can indeed improve brand attitude and that both the brand and category's positioning influence the introduction of green new products. They also find that the quantity of green messages| the product type| and their source credibility influence the extent to which green new products change brand attitude. The authors use these findings to provide guidance for managers as they attempt to effectively link their green innovation efforts to improve consumer attitudes toward their brands. © 2014| American Marketing Association.",1,Brand attitude; Green products; Innovation; Message framing; Source credibility,
Paharia N.,Paharia (2020),P_20,Who Receives Credit or Blame? The Effects of Made-to-Order Production on Responses to Unethical and Ethical Company Production Practices,2020,Journal of Marketing,84,1,88,104,16,14,https://www.scopus.com/inward/record.uri?eid=2-s2.0-85075348893&doi=10.1177%2f0022242919887161&partnerID=40&md5=95076a66301ce5e46b75c9b1b92e4369,While prior research has found that consumer-influenced production improves purchase intentions| the author proposes that it can counterintuitively backfire. This work demonstrates that when consumers have some control over production (e.g.| ordering products on demand| customization| preordering)| they have lower purchase intentions for products made with unethical processes (e.g.| pollution| underpaid labor) than if they had no role in production (i.e.| buying what is already in inventory). This effect reverses| however| with positive ethical production (e.g.| recycled materials). Because consumers have direct responsibility for whether a product is made| feelings of anticipated guilt or gratification result depending on the ethicality of the production process. This work also proposes a novel threefold conceptualization of responsibility that can be used as managerial levers: direct responsibility| diffusion of responsibility| and broad responsibility. Field studies using Facebook’s advertising platform demonstrate positioning strategies for fair-trade brands and advocacy groups. © American Marketing Association 2019.,1,agency; cocreation; customization; ethics; operations; supply chain; sustainability,
Peloza J.| White K.| Shang J.,Peloza| White & Shang (2013),PWS_13,Good and guilt-free: The role of self-accountability in influencing preferences for products with ethical attributes,2013,Journal of Marketing,77,1,104,119,15,219,https://www.scopus.com/inward/record.uri?eid=2-s2.0-84873312842&doi=10.1509%2fjm.11.0454&partnerID=40&md5=7a246b69f1c7eaa3c02d8bdaf6311124,The market share of brands positioned using ethical attributes typically lags behind brands that promote attributes related to product performance. Across four studies| the authors show that situational factors that heighten consumers' self-accountability (i.e.| activation of their desire to live up to their self-standards) lead to increased preferences for products promoted through their ethical attributes. They investigate their predictions regarding selfaccountability in multiple ways| including examining the moderating roles of awareness of the discrepancy between a person's internal standards and actual behavior| self-accountability priming| and the presence of others in the decision context. Furthermore| they demonstrate that the subtle activation of self-accountability leads to more positive reactions to ethical appeals than explicit guilt appeals. Finally| they show that preference for a product promoted through ethical appeals is driven by the desire to avoid anticipated guilt| beyond the effects of impression management. Taken together| the results suggest that marketers positioning products through ethical attributes should subtly activate consumer self-accountability rather than using more explicit guilt appeals. © 2013| American Marketing Association.,1,Environment; Ethical products; Green marketing; Self-accountability; Sustainability,
Reczek R.W.| Irwin J.R.| Zane D.M.| Ehrich K.R.,Reczek| Irwin| Zane & Ehrich (2018),RIZE_18,That's Not How i Remember It: Willfully Ignorant Memory for Ethical Product Attribute Information,2018,Journal of Consumer Research,45,1,185,207,22,35,https://www.scopus.com/inward/record.uri?eid=2-s2.0-85053030868&doi=10.1093%2fjcr%2fucx120&partnerID=40&md5=b28089407f66da8bd1cd9bb4cfff60d5,This research documents a systematic bias in memory for ethical attribute information: consumers have better memory for an ethical attribute when a product performs well on the attribute versus when a product performs poorly on the attribute. Because consumers want to avoid emotionally difficult ethical information (e.g.| child labor) but believe they should remember it in order to do the right thing| the presence of negative ethical information in a choice or evaluation produces conflict between the want and should selves. Consumers resolve this conflict by letting the want self prevail and forgetting or misremembering the negative ethical information. A series of studies establishes the willfully ignorant memory effect| shows that it holds only for ethical attributes and not for other attributes| and provides process evidence that it is driven by consumers allowing the want self to prevail in order to avoid negative feelings associated with the conflict. We also ameliorate the effect by reducing the amount of pressure exerted by the should self. Lastly| we demonstrate that consumers judge forgetting negative ethical information as more morally acceptable than remembering but ignoring it| suggesting that willfully ignorant memory is a more morally acceptable form of coping with want/should conflict. © 2017 The Author. Published by Oxford University Press on behalf of Journal of Consumer Research| Inc. All rights reserved.,1,consumer memory; ethical attributes; ethical decision making; sustainability; want/should conflict,
Ross G.R.| Meloy M.G.| Bolton L.E.,Ross| Meloy & Bolton (2021),RMB_21,Disorder and Downsizing,2021,Journal of Consumer Research,47,6,959,977,18,4,https://www.scopus.com/inward/record.uri?eid=2-s2.0-85105120845&doi=10.1093%2fjcr%2fucaa051&partnerID=40&md5=4c3edfbe356fbc314810b3dda9cf76dc,The consequences of overconsumption and the recent popularity of simple living point to consumer interest in reducing belongings. They also raise an interesting question-what is a useful approach to downsizing and decluttering? We investigate how dis/order (messy vs.Tidy items) affects downsizing and find| across nine focal studies| that (a) consumers retain fewer items when choosing from a disordered set because (b) order facilitates the comparisons within category that underlie the tendency to retain items. The impact of dis/order is altered by consumers' comparison tendencies| waste aversion| and decision strategy (selection vs. rejection)| which serve as theoretically and pragmatically relevant moderators. Though consumers' lay beliefs favor rejecting from order (i.e.| choosing what to get rid of from tidy items)| our findings point to the usefulness of selecting from disorder (i.e.| choosing what to keep from messy items) as a downsizing strategy. Together| this research has implications for consumer downsizing activities| the burgeoning home organization and storage industries| as well as sustainability. © 2020 The Author(s) 2020. Published by Oxford University Press on behalf of Journal of Consumer Research| Inc. All rights reserved. For permissions| please e-mail: journals.permissions@oup.com.,1,decision-making; disorder; downsizing; maximizing; select-reject processes; waste aversion,Mostly focus on downsizing| sustainability mentioned at the end
